{
  "dac_file": "out\\dac_partially_scanned.pdf",
  "generated_at": "2026-01-02T04:18:13.598891+00:00",
  "overall_status": "PARTIALLY_MET",
  "sections": [
    {
      "section_id": "1.1",
      "name": "General Information",
      "status": "MET",
      "checks": [
        {
          "check_id": "S1.1-01",
          "name": "CMS Product ID present",
          "status": "MET",
          "severity": "major",
          "message": "",
          "evidence": {
            "value": "1513344"
          }
        },
        {
          "check_id": "S1.1-02",
          "name": "IT Asset ID present",
          "status": "MET",
          "severity": "major",
          "message": "",
          "evidence": {
            "value": "AID551"
          }
        },
        {
          "check_id": "S1.1-03",
          "name": "IT Asset Name present",
          "status": "MET",
          "severity": "major",
          "message": "",
          "evidence": {
            "value": "MICROSOFT OFFICE 365"
          }
        }
      ]
    },
    {
      "section_id": "2.0",
      "name": "Process Evidence (PDFs)",
      "status": "MET",
      "checks": [
        {
          "check_id": "S2.0-01",
          "name": "Evidence PDF present: Chapter1.pdf",
          "status": "MET",
          "severity": "major",
          "message": "",
          "evidence": {
            "file": "daisy_test_data\\Chapter1.pdf"
          }
        },
        {
          "check_id": "S2.0-02",
          "name": "Evidence PDF present: Chapter2-3.pdf",
          "status": "MET",
          "severity": "major",
          "message": "",
          "evidence": {
            "file": "daisy_test_data\\Chapter2-3.pdf"
          }
        },
        {
          "check_id": "S2.0-03",
          "name": "Evidence PDF present: Provisioning & Assignment of Access.pdf",
          "status": "MET",
          "severity": "major",
          "message": "",
          "evidence": {
            "file": "daisy_test_data\\Provisioning & Assignment of Access.pdf"
          }
        },
        {
          "check_id": "S2.0-04",
          "name": "Evidence PDF present: Review and Approval of Access.pdf",
          "status": "MET",
          "severity": "major",
          "message": "",
          "evidence": {
            "file": "daisy_test_data\\Review and Approval of Access.pdf"
          }
        },
        {
          "check_id": "S2.0-05",
          "name": "Evidence PDF present: Recertification.pdf",
          "status": "MET",
          "severity": "major",
          "message": "",
          "evidence": {
            "file": "daisy_test_data\\Recertification.pdf"
          }
        },
        {
          "check_id": "S2.0-01-TXT",
          "name": "Evidence PDF has extractable text: Chapter1.pdf",
          "status": "MET",
          "severity": "major",
          "message": "",
          "evidence": {
            "file": "daisy_test_data\\Chapter1.pdf",
            "page_count": 10,
            "text_chars": 0,
            "image_count": 20,
            "ocr_enabled": true,
            "ocr_required": true,
            "ocr_available": true,
            "ocr_attempted": true,
            "ocr_lang": "eng",
            "ocr_dpi": 200,
            "ocr_pages": 2,
            "ocr_text_chars": 1731,
            "ocr_cache_hit": false,
            "ocr_succeeded": true,
            "ocr_pages_requested": [
              0,
              1
            ],
            "ocr_pages_used": [
              0,
              1
            ],
            "text_chars_after_ocr": 1731
          }
        },
        {
          "check_id": "S2.0-02-TXT",
          "name": "Evidence PDF has extractable text: Chapter2-3.pdf",
          "status": "MET",
          "severity": "major",
          "message": "",
          "evidence": {
            "file": "daisy_test_data\\Chapter2-3.pdf",
            "page_count": 11,
            "text_chars": 0,
            "image_count": 22,
            "ocr_enabled": true,
            "ocr_required": true,
            "ocr_available": true,
            "ocr_attempted": true,
            "ocr_lang": "eng",
            "ocr_dpi": 200,
            "ocr_pages": 2,
            "ocr_text_chars": 2272,
            "ocr_cache_hit": false,
            "ocr_succeeded": true,
            "ocr_pages_requested": [
              0,
              1
            ],
            "ocr_pages_used": [
              0,
              1
            ],
            "text_chars_after_ocr": 2272
          }
        },
        {
          "check_id": "S2.0-03-TXT",
          "name": "Evidence PDF has extractable text: Provisioning & Assignment of Access.pdf",
          "status": "MET",
          "severity": "major",
          "message": "",
          "evidence": {
            "file": "daisy_test_data\\Provisioning & Assignment of Access.pdf",
            "page_count": 3,
            "text_chars": 4460,
            "image_count": 3,
            "ocr_enabled": true,
            "ocr_required": false,
            "ocr_available": false,
            "ocr_attempted": false
          }
        },
        {
          "check_id": "S2.0-04-TXT",
          "name": "Evidence PDF has extractable text: Review and Approval of Access.pdf",
          "status": "MET",
          "severity": "major",
          "message": "",
          "evidence": {
            "file": "daisy_test_data\\Review and Approval of Access.pdf",
            "page_count": 3,
            "text_chars": 2633,
            "image_count": 3,
            "ocr_enabled": true,
            "ocr_required": false,
            "ocr_available": false,
            "ocr_attempted": false
          }
        },
        {
          "check_id": "S2.0-05-TXT",
          "name": "Evidence PDF has extractable text: Recertification.pdf",
          "status": "MET",
          "severity": "major",
          "message": "",
          "evidence": {
            "file": "daisy_test_data\\Recertification.pdf",
            "page_count": 2,
            "text_chars": 2668,
            "image_count": 2,
            "ocr_enabled": true,
            "ocr_required": false,
            "ocr_available": false,
            "ocr_attempted": false
          }
        }
      ]
    },
    {
      "section_id": "4.1",
      "name": "Entitlements",
      "status": "PARTIALLY_MET",
      "checks": [
        {
          "check_id": "S4.1-01",
          "name": "SoD relevancy recorded (yes/no)",
          "status": "MET",
          "severity": "critical",
          "message": "",
          "evidence": {
            "value": "no"
          }
        },
        {
          "check_id": "S4.1-02",
          "name": "Functional Area relevancy recorded (yes/no)",
          "status": "SKIPPED",
          "severity": "major",
          "message": "Missing/unparseable yes/no in DAC PDF (lenient mode).",
          "evidence": {}
        },
        {
          "check_id": "S4.1-03",
          "name": "Entitlement composition upload decision recorded (yes/no)",
          "status": "SKIPPED",
          "severity": "major",
          "message": "Missing/unparseable yes/no in DAC PDF (lenient mode).",
          "evidence": {}
        },
        {
          "check_id": "S4.1-F01",
          "name": "Export present: Entitlement Services.xlsx",
          "status": "MET",
          "severity": "major",
          "message": "",
          "evidence": {
            "file": "daisy_test_data\\2025_11_11_Report_DAC_Template_Resource_MICROSOFT_OFFICE_365_Entitlement Services.xlsx"
          }
        },
        {
          "check_id": "S4.1-F02",
          "name": "Export present: All Entitlements.xlsx",
          "status": "MET",
          "severity": "major",
          "message": "",
          "evidence": {
            "file": "daisy_test_data\\2025_11_11_Report_DAC_Template_Resource_MICROSOFT_OFFICE_365_All Entitlements.xlsx"
          }
        },
        {
          "check_id": "S4.1-EX-01",
          "name": "Entitlement Services: required master data filled",
          "status": "MET",
          "severity": "major",
          "message": "MVP warning: 33 of 572 rows failed (tolerance=57).",
          "evidence": {
            "total_rows": 572,
            "failing_rows": 33,
            "samples": [
              {
                "Display name": "BC_AGMQAPrepTool_EBMembers @ oa.pnrad.net",
                "Description": NaN,
                "SoD Area": "XX - Not SoD-relevant",
                "Tier Level": 3.0
              },
              {
                "Display name": "MDO-RBAC-Full-Management @ oa.pnrad.net",
                "Description": NaN,
                "SoD Area": "XX - Not SoD-relevant",
                "Tier Level": 1.0
              },
              {
                "Display name": "O365-LG-CopilotStudio @ oa.pnrad.net",
                "Description": "Owner: xa359_Benoit Krier, ha995_Martin Puaud",
                "SoD Area": "XX - Not SoD-relevant",
                "Tier Level": NaN
              },
              {
                "Display name": "O365-LG-E5-SharedMBX-ConfCall @ oa.pnrad.net",
                "Description": "Owner: xa359_Benoit Krier, ha995_Martin Puaud",
                "SoD Area": "XX - Not SoD-relevant",
                "Tier Level": NaN
              },
              {
                "Display name": "O365-LG-PowerAppsUser-Atlas @ oa.pnrad.net",
                "Description": "Owner: xa359_Benoit Krier, ud637_Johannes Hugo",
                "SoD Area": "XX - Not SoD-relevant",
                "Tier Level": NaN
              }
            ]
          }
        },
        {
          "check_id": "S4.1-EX-02",
          "name": "Entitlement Services: descriptions are meaningful",
          "status": "MET",
          "severity": "major",
          "message": "MVP warning: 21 of 572 rows failed (tolerance=57).",
          "evidence": {
            "total_rows": 572,
            "failing_rows": 21,
            "samples": [
              {